,0
539,Oth.industrial monocarboxylic fatty acids/ac.oils.refin
540,"Oth.appar.of x-rays,f/radiography or radiotherapy"
541,"Radiocobalt apparatus(cobalt bombs),medical uses,etc"
542,"Gamma therapy apparatus f/medical,surgical,etc."
543,"Oth.radiation appar.alpha/beta/gama,f/medical uses,etc."
544,"Other radiation apparatus alpha, beta or gama"
545,"Gamma rays,f/detect.stuffing level/cover of drink can"
546,"Other radiation apparatus alpha, beta or gama"
547,X-ray tubes
548,"Voltage generators,f/x-rays appar./other radiations"
549,"X-ray screens,f/x-rays apparatus/other radiations"
550,Other x-rays generators apparatus
551,Other x-rays generators devices
552,"Parts and access.f/x-rays appar./other radiations,etc."
553,Mach.appl.f/testing tensile strength/metals compress.
554,Machines and appliances f/testing hardness
555,Saddles for motor-cycles (including mopeds)
556,Other parts and access.f/motor-cycles incl.mopeds
557,Parts and access.of carriag.f/disabled/oth.vehic.inval.
558,"Frames,forks and parts thereof f/bicycles and oth.cycl."
559,Wheel rims and spokes f/bicycles and other cycles
560,"Oth.hubs and sprocket-wheels f/bicycles,etc"
561,"Hubs,exc.of brakes(coaster brak.)p/bicyc.and oth.cycles"
562,Centralizing of lines of subscribers (centr/remot.term.)
563,Other centralizing appar/equip
564,"Public central, eletron. commutator, includ. traffic"
565,"Private autom.central, capac.<=25 internal lines"
566,"Priv. autom.central, capac.>25 intern. lines and <=200 intern. lines"
567,"Private autom.central, capac.>200 internal lines"
568,Other commut. aut. centr. for teleph.line excep. videotext
569,Commut.auto.centr. of pack. trunk speed>72kbits/s
570,Other commut. aut. centr. for packages
571,Automatics central of trunk system
572,Parts and accessories of shotguns or rifles (9303)
573,"Mach.and appliances f/testing yarn,automatic"
574,Other machines and appliances for testing textile
575,"Machin.and appl.f/testing paper,paperb.linoleum,etc"
576,Machines for testing tires
577,"Other machin.and appl.f/testing paper,paperb.linoleum,etc"
578,"Oth.machin.and appl.f/testing hardness,etc.of materials"
579,"Parts and acces.of mach.and appl.f/testing hardness,etc"
580,"Clinical thermometers,of liquid,of direct reading"
581,"Oth.thermometers and pyrom.of liquid,of direct reading"
582,Optical pyrometers
583,Other thermometers and pyrometers
584,"Hydrometers,areometers and other floating instruments"
585,Parts and accessories of thermometers
586,Parts and access.of hydrometers and oth.instruments
587,"Electr.measuring transmitters,operat.by electrom.induct"
588,Oth.instrum.and applian.f/measuring/checking the flow
589,Instruments and applian.f/measuring/checking the level
590,"Instrum.and appl.f/measuring/checking the level,metals"
591,"Parts and acces.f/shotguns/carbines,smooth barrel"
592,Parts and acces.f/other shotguns/carbines
593,Parts and accessories for military weapons
594,Parts and accessories for other arms
595,"Parts/accessorries of military weapons,etc"
596,Parts/accessories of other arms
597,Cartridges for riveting/captive-bolt humane killers
598,Cartridges shotguns/carbines of smooth barrel
599,"Lead f/carbines of compressed air,parts f/cartridges"
600,Other cartridges and parts thereof
601,"Bombs,grenades,oth.munitions of war and parts thereof"
602,"Swords,cutlasses,bayonets,oth.arms and parts thereof"
603,"Ejector seats, for aircraft"
604,"Other seats for aircraft, except ejector seats"
605,Seats for motor vehicles
606,"Swivel seats with variable height adjustment,of wood"
607,Swivel seats with variab.height adjustm.of oth.material
608,"Seats convertible into beds, of wood"
609,"Seats convertible into beds,of oth.materials"
610,Oth.instruments and appl.f/measuring/checking the level
611,Manometers
612,Oth.instrum.and appl.f/measuring/checking the pressure
613,"Oth.instrum.and appl.f/measuring/checking  liquid,etc"
614,Parts of access.instr.and appl.f/measur./checking level
615,Parts and accessories for manometers
616,Parts of access.f/oth.instr.and appl.f/meas./checking
617,Gas or smoke analysis apparatus
618,Chromatographs of gaseous phase
619,Chromatographs of liquid phase
620,Other chromatographs
621,Electrophoresis instruments
622,Automatic dna sequencing by means of capil.electrop.
623,Other electrophoresis instruments
624,Spectrometers of optical emission (atomic emission )
625,Other spectrometers
626,Spectrophotometers
627,"Spectrophotometers of uv radiations,visible and ir"
628,Spectrophotometers of atomic absorption
629,Spectrophotometers of optical emission(atomic emission)
630,Other spectrophotometers
631,"Seats of cane,osier,bamboo or similar materials"
632,"Seats of rattan, bamboo or similar materials"
633,"Other seats of rattan, bamboo or similar materials"
634,"Upholstered seats, with wooden frames"
635,"Other seats, with wooden frames"
636,"Upholstered seats, with metal frames"
637,"Other seats, with metal frames"
638,Other seats
639,"Parts for seats, of wood"
640,"Parts for seats, of other materials"
641,"Dentists', barbers', or similar chairs and parts thereof"
642,Tables for surgical operation
643,Hospital beds with mechanical fittings
644,"Other furnitures for medicine,surgery,dentistry,etc."
645,Metal furniture for offices
646,Other metal furniture
647,Wooden furniture for offices
648,Wooden furniture for kitchen
649,Wooden furniture for bedroom
650,Other wooden furniture
651,Other articles for funfair
652,Automatic bowling
653,Other articles for funfair
654,Articles for christmas festivities
655,Festive carnival or other entertainment articles
656,Skis for snow
657,Ski fastenings
658,Other articles and equipment f/skiing in the snow
659,Sailboards
660,Aquatic skis and oth.equipment f/aquatic sports
661,Complete clubs for golf
662,"Tubes for microwaves, klystrons"
663,Other tubes for microwaves
664,Receiver or amplifier tubes
665,Potency valves for transmissions
666,"Other lamps,tubes,valves,electronic,etc"
667,Deflection coils (yokes) for cathode-ray tubes
668,Ferrite cores for deflection coils
669,Electronic guns for cathode-ray tubes
670,"Assem.cons.of glass panel in grid,etc.f/trichrom.tubes"
671,Other parts for cathode-ray tubes
672,"Parts of lamps,other tubes and valves,electron.etc."
673,"Diodes not mounted, zener"
674,"Diodes not mounted, of current intensity<=3a"
675,Other diodes not mounted
676,"Zener diodes mounted f/surface mounted device(""smd"")"
677,"Diodes mounted,f/surf.moun.dev.of current intensity<=3a"
678,"Other diodes mounted f/surface mounted device(""smd"")"
679,Other zener diodes
680,Other diodes of current intensity<=3a
681,"Oth.diodes,oth.than photo-diodes/ light-emitting diodes"
682,"Dumpers f/the transp.of goods,for off-highway use"
683,"Dumpers f/the transp.of goods>=85t,f/off-highway use"
684,"Oth.dumpers f/the transp.of goods,f/off-highway use"
685,"Chassis fitted with dies.engine/cab,of gross weight<=5t"
686,Motor vehicles with diesel engine/tipping body weig<=5t
687,Motor vehicles refriger.etc.with diesel engineweig<=5t
688,"Other motor vehicles with diesel engine,weigh<=5t"
689,"Chassis fitted with dies.engine and cab,5t<weig<=20t"
690,Motor vehic.with diesel engine/tipp.body 5t<weig<=20t
691,"Motor vehic.refrig.etc.with diesel engine,5t<wei<=20t"
692,"Oth.motor vehicles with diesel engine,5t<wei<=20t"
693,"Chassis fitted with dies.engine and cab,wei>20t"
694,Motor vehicles with diesel engine/tipp.body wei>20t
695,"Motor vehic.refriger.etc.with diesel engine,wei>20t"
696,"Oth.motor vehicles with diesel engine,wei>20t"
697,"Chassis fitted with motor explosion and cab,wei<=5t"
698,Telescopic sights for fitting to arms
699,"Periscopes,telescopes f/optical mach.appl.instruments"
700,"Lasers, other than laser diodes"
701,Liquid crystal devices (lcd)
702,"Other devices,optical appliances and instruments"
703,"Parts and access.of telescopic sights,periscopes,etc."
704,Direction finding compasses
705,Height measure for aeronautical or space navigation
706,Automat.pilots f/aeronautical or space navigation
707,Inclinometers for aeronautical or space navigation
708,Oth.instrum.and applian.f/aeronautical/space navigation
709,Echo sounding or ultrasonic sounding f/navigation
710,Other instruments and appliances f/navigation
711,Parts and acess.f/instrum.and appliances f/navigation
712,Rangefinders
713,"Theodolites and tachymeters,with prism,etc.prec=1sec"
714,Other theodolites and tachymeters
715,Levels
716,"Photogrammetrical,surveying instruments and appliances"
717,Bucket-wheel current meters/hydrometric paddle wheels
718,"Digit.trans.appar.f/voice/data, oper.c, ku, l or s band"
719,Ot.transmission appar. inc.recep.of satellite telecom.
720,Transmis.appar./recep.of cellul.telefhon.f/base station
721,Portable apparatus of cellular telephonic
722,Fixed appar.of cellul.teleph.without inter.power source
723,"Portable apparatus of cellular teleph., f/motor vehicles"
724,Oth.transmis.appar.recep.of cellulartelefhonic
725,Transm.appar./recep.of type modems
726,Transm.appar./recep.of radio-broadcasting
727,Other articles of cobalt
728,Bismuth in brute
729,"Bismuth articles, including waste and scrap, of bismuth"
730,Liquid elevators
731,Parts of pumps for liquids
732,Rods of pumping for extraction of oil
733,Other parts of pumps for liquids
734,Parts of elevators of liquids
735,Vacuum pumps
736,Hand or foot-operated air pumps
737,"Hermetic moto-compressor, capacity<4700 calories/hour"
738,Oth.hermetic moto-compressors refrigerating equipment
739,Compressor f/refrigerating equipm.cap<=16000 calories/h
740,Other compressors for refrigerating equipment
741,"Air compressors, of alternative displacement"
742,"Air compressor, of screw, moun.wheeled chassis f/towing"
743,"Oth.air compressors, mount.on a wheeled chassis f/towing"
744,"Table fan, with electric motor, of potency<=125w"
745,"Celling fan, with electric motor, of potency<=125w"
746,"Other fans with electric motor, of potency<=125w"
747,Micro-fans with bodies of a surface area<90cm2
748,Other fans
749,Other rotary boring machinery
750,Other boring machinery/perforation
751,"Other self-propelled earth-moving, etc."
752,"Tamping or compacting machinery, etc.exc.self-propelled"
753,"Ot.scraping-transpor.of earth, etc.exc.self-propelled"
754,"Front equipments f/dig-loaders, etc.cap>4m3"
755,Indicator panels incor.liquid crystal/light emit.diodes
756,Other electric sound or visual signalling apparatus
757,Parts of electric sound or visual signalling apparatus
758,"Fixed capacitors, f/elect.line 50/60hz, pot>=0.5kvar"
759,"Elect.capacit., fixed of tantalus, f/surf.mounted device"
760,"Electr.capacit., fixed of tantalus, surf.moun.dev.t<=125v"
761,"Oth.elec.capacit., fixed of tantalus, f/surf.mount.device"
762,"Other electrical capacitors, fixed of tantalus"
763,"Electrolytic fixed capacitors, of aluminium"
764,"Fixed capacitors with ceram.diel.single layer, surf.moun"
765,Oth.fixed capacitors with ceram.diel.single layer
766,Oth.fixed capacit.with ceram.diel.surf.moun.device
767,"Other eletric.machinery with sel function, not mentioned"
768,Proximity cards and tags
769,"Radio-freq.amplifier f/transmit.microwave sign,hpa,etc"
770,"Radio-freq.amplifier f/receiving microwave sign,lna,etc"
771,Radio-freq.amplifier f/broadcasting television signals
772,Other radio-freq.amplifier f/receiv.microwave signals
773,Oth.radio-freq.amplifier f/transmit.microwave signals
774,Other radio-frequency amplifiers
775,Appliances for electrocuting insects
776,Gener.of special effects with man.2/3 dimen.etc.f/video
777,"Digital character generators, for video"
778,"Frame synchronizer,etc.time base recorders,f/video"
779,"Editing controller, for video"
780,"Real time digital mixers>=8 input,f/video"
781,"Routing switches 20<input,16<output,f/video"
782,"Other machines and auxiliary apparels,for video"
783,Television standard transcoders or converter
784,"Propellers,rotors and parts thereof f/aircraft,etc."
785,"Under-carriages and parts thereof f/aircraft,etc."
786,Other parts of aeroplanes or helicopters
787,Other parts for aircraft/space
788,"Parachutes/rotochutes,its parts and access."
789,"Apparatus and devices f/aircraft launching,etc.parts"
790,Flight simulators apparatus and parts thereof
791,Air combat simulators and parts thereof
792,"Other ground flight training apparatus,etc"
793,"Cruise ships, excursion boats, ferry-boats,etc"
794,Tankers ships
795,"Refrigerated vessels, excluding tankers"
796,Oth.vessels f/the transp.of goods or persons/goods
797,"Oth.light-emitting diodes (led) n/mounted,exc.laser"
798,Laser diodes with wavelength 1300mm or 1500mm
799,Other laser diodes
800,Photo-diodes/photo-transistors/photo-thyristors mounted
801,Photo-resistors mounted
802,"Optic couplers,for surface mounted device (smd)"
803,Oth.photosensitive semiconductor device mounted
804,Photo-diodes in modules or panels
805,Solar cells in modules or panels
806,Other photovoltaic cells in modules or panels
807,Other semiconductor devices not mounted
808,Other semiconductor devices mounted
809,"Mount.piezo-electr.crystals,of quartzo,1<=freq<=100mhz"
810,Other mounted piezo-electric crystals
811,"Support-connector in strips,diodes,etc.semiconductor"
812,Coverings for making capsules
813,"Oth.parts of diodes,transistors,etc.semiconduct."
814,Chassis with engines f/dumpers and tractors exc.road
815,Oth.chassis with engines f/automobiles of passeng/goods
816,"Bodies (including cabs),for automobiles of passengers"
817,Bodies (incl.cabs) f/dumpers/tractors exc.road
818,Bodies f/motor vehic.transp>=10persons or f/load
819,Bumpers and parts thereof f/motor vehicles
820,Seatbelts for motor vehicles
821,Mudguards f/dumpers and tractors exc.road
822,Radiator cowlings for dumpers/tractors exc.road
823,Doors for dumpers and tractors except road
824,Dashboards for dumpers/tractors except road
825,Other parts/acess.of bodies f/dumpers and tractors
826,Mudguards for motor vehicles
827,Radiator cowlings for motor vehicles
828,Doors for motor vehicles
829,Dashboards for motor vehicles
830,Gas gener.to inflate airbags/activ.safety belt ratract.
831,Inflatable bags for automobiles airbags
832,Scintigraphic apparatus
833,Positron emission tomography scanner
834,Gamma chambers
835,Other scintigraphic apparatus
836,Endoscopy
837,Audiometers
838,Gamma chambers
839,Other electro-diagnostic apparatus
840,Parts of electro-diagnostic apparatus
841,Ultraviolet or infrared ray apparatus
842,"Surgery apparatus,laser type"
843,"Other apparatus f/oral treatment,laser type"
844,Other ultraviolet or infrared ray apparatus
845,"Syringes of plastic,with or without needles,cap<=2cm3"
846,"Other syringes of plastic,with or without needles"
847,"Syringes of other material,with or without needles"
848,"Tubular metal needles, gums"
849,"Tubul.needles,of steel chrome-niquel/three-sided bisel"
850,Other tubular metal needles
851,Needles for sutures
852,Other needles
853,"Probes, catheters and stems, of rubber"
854,Other television cameras
855,Still image video cameras and oth.video camera
856,Video camera with 3 or more image recorders
857,Oth.video cameras f/capturing infrared spectrum
858,Other video cameras
859,Apparatus for broadcasting on am
860,Apparatus for broadcasting on fm
861,Other transm. appar./equip. for radio-broadcasting
862,"Appar. of television, with freq.>7ghz"
863,"Appar. of telev., uhf band, 2.0 to 2.7 ghz, pot. 10 to 100w"
864,"Appar. of telev., uhf band, output pot.>10kw"
865,"Appar. of telev., uhf band, output pot.>=20kw"
866,Other television transmitter apparatus
867,Transm./recept.appar. of radio-broadcasting
868,"Transm./recept.appar. of television, freq.>7ghz"
869,Other transm.appar.with recept. of telev.
870,Tv cameras with 3 or more image pickups (captivators)
871,"Tv cameras with ccd imag. sensor, etc. light.< 0, 20 lux"
872,Cards incorporating an electronic integrated circuit
873,Cards incorporating 1 electronic integrated circuit
874,"Oth.rom, prom,etc.memoirs,mounted,f/surf.moun.dev."
875,"Oth.memories,mounted,f/surface mounted device"
876,"Oth.dig.monolithic integ.circuits,moun.,f/surf.moun.dev"
877,"Other rom,prom,etc.memories,mounted"
878,Other mounted memories
879,"Other digital monolithic integrated circuits,mounted"
880,"Digital monolithic integrated circuits,n/mounted"
881,"Static memories (sram) with time<=25ns,mounted"
882,"Microprocessors,mounted,f/surface mounted device"
883,"Microcontrollers,mounted,f/surface mounted device"
884,"Co-processors,mounted,f/surface mounted device"
885,"Monolithic integrated circuits,mounted,""chipset"""
886,Drive-axles with differential f/motor vehicles
887,Axles and parts except. drive/trac./dumpers
888,"Other axels and its parts,f/motor vehicles"
889,"Oth.axels and its parts,f/dumpers/tractors exc.road"
890,"Other axels and its parts,f/motor vehicles"
891,"Wheels of propellers axels its parts,f/dumpers/tractors"
892,"Other wheels,its parts and acess.f/motor vehicles"
893,Suspension shock-absorbers f/tractors and motor vehic.
894,Radiators f/tractors and motor vehicles
895,Silencers and exhaust pipes f/tractors and motor vehic.
896,Clutches and parts thereof f/tractors and motor vehic.
897,Steering wheel  f/dumpers/tractors exc.road
898,Steering columns f/dumpers/tractors exc.road
899,Steering boxes f/dumpers/tractors exc.road
900,Steering wheels for motorized vehicles
901,Steering columns for motor vehicles
902,Steering boxes for motor vehicles
903,Other parts and access.f/tractors and motor vehicles
904,Binocular microsc.of a kind used in ophthalmic surgery
905,Other ophthalmic instruments and appliances
906,"Instruments and appliances,f/blood transfusions,etc"
907,Electric bistouries
908,Other bistouries
909,Lithotriptors using shock waves
910,Lithotomes and other lithotriptors
911,Artificial kidney
912,Diathermy apparatus
913,Artificial incubators for babies
914,Apparatus for measuring arterial pressure
915,"Microwave intra-urethral therapy equipment,computer."
916,Endoscope
917,"Clips,applicators ,extractors f/appar.used medical,etc"
918,Automatic external defibrillators
919,"Oth.instrum.and appliances used in medical,surgery,etc"
920,Mechano-therapy appl.of massage/of psych.aptitude-testi
921,Oxygen therapy apparatus
922,Aerosol therapy apparatus
923,Artificial respiration apparatus
924,Appliances known as iron lungs
925,Ozone therapy apparatus and oth.of therapeutic respir.
926,Combined w / sound recording or playback sound
927,"Recep.appar.radio casset.players, f/motor vehicles"
928,Ot.recep.appar.radio-br.with sound appar.f/motor vehic.
929,"Oth.recep.appar.radio-broadcasting f/motor vehicles, etc"
930,Oth.recep.appar.radio-br.with casset.players/recorded
931,Oth.recep.appar.radio-br.with cass.players/cass./recor.
932,Oth.recep.appar.radio-br.with recor.appar./sound reprod
933,"Recep.appar.of radio with clock, by electricity"
934,Tuning amplifiers (receiver)
935,"Oth.reception apparatus for radio-broadcasting, etc."
936,Reception appar.personal of radium-mes.in screen(ecran)
937,Other reception appar.personal of radium-message
938,Ot.recep.app.radio-telep./radio-telegr./radio-broad.etc
939,Apar.recep.f/broadcasting w/apar. of rec/play sound
940,Other radio-broad.recep.appar/equip. comb. with cass.play. and rec.
941,"Other mounted memories,f/surface mounted device"
942,"Other digital monolithic integrated circuits,mounted"
943,Other static memories with an access time<=25ns
944,Other microprocessors
945,Other microcontrollers
946,Other co-processors
947,"Other digital monolithic integrated circuits ""chipset"""
948,Other memories
949,Other commut. appar./equip. for teleph./telegraph.
950,Digital routers with capac.by wireless connection
951,Digital routers with serial interface speed 4mbits/sec
952,Other digital routers
953,Equip.of term./ repeat. in metalic lines
954,"Equip. of term./repeat.optic fiber with speed>2,5gbits/s"
955,"Output unit for video, with policr. crt (cathode ray tube)"
956,Monitors with monocr. crt (cathode ray tube)
957,"Video monitors, colour, with sweep selec."
958,Monitors with policr. crt (cathode ray tube)
959,"Other monit. used exclusively. with auto. machin. of  84.71 posi., monocr."
960,"Other monit. used exclusively. with auto. machin. of  84.71 posi., policr."
961,"Other video output unit, policr."
962,Other monochrome monitors
963,Other monitors polychromatic
964,Other input/output units for data proc.mach.
965,Other vídeo projectors
966,With technology dmd (digital micromirror device)
967,Other projectors
968,"Other integ.dec.rec., without radiofreq.output, with audio input"
969,"Other dig.sign integr.rec.dec. of cod. video, colour"
970,Other rec. appar.of mm telev.comb. with other colour
971,"Hybr.integ.circuit thick.of layer<=1micron,freq>=800mhz"
972,Oth.hybr.integ.circuit thick.of layer<=1micron
973,Other hybrid integrated circuits
974,Electronic microassemblies
975,"Hybrid integrated circuits,t<=1micron f>=800mh"
976,"Other hybrid integrated circuits,t<=1micron"
977,Other hybrid integrated circuits
978,Electronic microassemblies
979,"Support-connector in strips,f/integ.circuits,etc.electr"
980,"Coverings f/making capsules,f/integ.circuits,etc.electr"
981,Oth.parts f/integ.circuits and electr.microassemblies
982,Particle accelerators
983,Ion implanters for doping semiconductor materials
984,Other electric particle accelerators
985,Electric signal generators
986,"Mach.appar.f/electroplat.electrolysis,electrophoresis"
987,Electric fence energisers
988,Radio-freq. amplifier for microwave pot>2.7kw v.twt
989,Free-wheel sprocket-wheels p/bicyc.and oth.cycles
990,Coaster braking hubs p/bicycles and other cycles
991,Oth.brakes and parts thereof f/bicycles and oth.cycles
992,Saddles of bicycles and other cycles
993,"Pedals,crank-gear and parts thereof,f/bicycles,etc."
994,Oth.parts and access.f/bicycles and other cycles
995,Speed changers f/bicycles and other cycles
996,Other parts and access.f/bicycles and other cycles
997,"Baby carriages,similar vehicles and parts thereof"
998,Trailers/semi-trailers f/housing or camping
999,"Trailers/self-unload.semi-trailers,etc.f/agricul.purp."
1000,Tanker trailers for the transport of goods
1001,Oth.tanker trailers semi-trailers f/the transp.of goods
1002,Other tanker trailers semi-trailers
1003,Other vehicles no no self-propellers
1004,Chassis for trailers and semi-trailers
1005,Oth.parts of trailers/semi-trailers/vehicl.n/self-prop.
1006,Gliders and hang gliders
1007,Gliders and hang gliders
1008,Text terminals that oper.with baudot´s code transm.
1009,Hubs
1010,Modems for telecom. (dig.port)
1011,Other equip. of term. or repeat.
1012,Transm./recep. appar/equip.of trunk system
1013,Transm./recep. appar/equip.of cellular telephony
1014,Transm./recep. appar/equip.of telec.by satellite
1015,"Transm./recep. appar/equip.for  sat . dig. oper. band c, ku"
1016,Other transm./recep. appar./equip.for satellite
1017,"Portable.term.of amateur radio (ham) system, transm.<=112kbits/s"
1018,"Radio/teleph. appar/equip.dig. freq<15ghz, rate<=34mbits/s"
1019,Furniture of plastics
1020,"Furniture of oth.materials,incl.cane,osier,bamboo,etc."
1021,Other varistors
1022,Spectrographs of optical emission(atomic emission)
1023,Other spectrographs
1024,Exposure meters
1025,Colorimeters
1026,Photometers
1027,Refractometers
1028,Saccharimeters
1029,Flow cytometers
1030,Oth.instr.and appar.using optical radiations
1031,Calorimeters
1032,Viscosimeters
1033,Densitometers
1034,Ph-meters apparatus
1035,Mass spectrometers
1036,Polarographs
1037,"Oth.instrum.and appl.f/analysis/testing/measuring,etc"
1038,Light meter
1039,"Other instrum.and appl.for analysis/testing/measuring,etc"
1040,Microtomes
1041,Parts and access.f/spectrometers of optical emission
1042,Parts and access.f/spectrographs of optical emission
1043,Parts and accessories of polarographs
1044,"Parts and access.f/oth.instrum.and appl.f/analysis,etc"
1045,"Compressed natural gas meters, electronic"
1046,"Compressed natural gas meters,electronic,f/gas stations"
1047,"Furniture of oth.materials,incl.rattan,osier,bamboo,simil. mat."
1048,Parts for wooden furniture
1049,"Parts for furniture, of other materials"
1050,Mattress supports
1051,"Rubber mattresses/alveolar plastics, including covered ones"
1052,Mattresses of other materials
1053,Sleeping bags
1054,"Eiderdowns, cushions, pouffes, pillows and simil.articles"
1055,Scyalitic lamps
1056,"Chand.and elect.lamps ligh.fittin.of stone,f/ceil/wall"
1057,"Chand.and elect.lamps ligh.fittin.of glass,f/ceil/wall"
1058,Chand.and elect.lamps ligh.fittin.base met.f/ceil/wall
1059,Chand.and elect.lamps ligh.fittin.oth.mat.f/ceil/wall
1060,"Bedside or office electric lamps,etc"
1061,Lighting sets for christmas trees
1062,"Oth.electric lamps and lighting fittings,of base metal"
1063,"Oth.electric lamps and light.fittings,of oth.materials"
1064,Non-electrical lamps and lighting fittings
1065,"Illuminated signs,illuminated name-plates,etc."
1066,"Other compressed natural gas meters, electronic"
1067,Other gas meters
1068,"Liquid meters, weight <= 50kg"
1069,"Liquid meters, weight > 50kg"
1070,"Monophase meters,p/alter.elec.current,digital"
1071,"Other monophase meters,p/alter.elec.current"
1072,"Electricity two-phase meters,digital"
1073,Other electricity two-phase meters
1074,"Electricity triphases meters,digital"
1075,Other electricity triphases meters
1076,Other electricity meters
1077,Parts and accessories electricity meters
1078,Parts and accessories f/gas/liquid meters
1079,Revolution counters or product.counters/hour meters
1080,"Taximeters,totalizers of traveled road,etc"
1081,Speed indicators and tachometers
1082,Stroboscopes
1083,Parts and access.f/speed indicators/tachometers
1084,Parts and access.f/other counters/stroboscopes
1085,Instruments and apparatus for measuring radioactivity
1086,Oth.instr.and apparatus f/measuring ionising radiations
1087,"Parts f/lamps and lighting fittings,of glass"
1088,"Parts f/lamps and lighting fittings,of plastic"
1089,"Parts f/lamps and lighting fittings,of other materials"
1090,Prefabricated greenhouses
