,0
1091,"Other prefabricated buildings, of wood"
1092,"Other prefabricated buildings, of iron or steel"
1093,"Other prefabricated buildings, of other materials"
1094,Wheeled toys for children and dolls' carriages
1095,"Dolls represent.human beings,with mechan./electric"
1096,"Other dolls repres.human beings,whether or not dressed"
1097,Garments and acces.therefor f/dolls repres.human beings
1098,Other parts and access.f/dolls repres.human beings
1099,Wheeled toys f/children and dolls' carriages
1100,"Fishing vessels,factory ships,etc.length>=35m"
1101,"Other fishing vessels,factory ships,etc."
1102,Inflatable boats
1103,"Sailboats,with or without auxiliary motor"
1104,"Printed circuits mounted f/telephonic, etc."
1105,"Laser printing mechanisms, etc.f/facsimile apparatus"
1106,Furniture and framew.f/telephonic/telegraphic apparatus
1107,"Registrars/selectors f/central automatic phone, etc."
1108,Piezo-electric transducers for telephone set
1109,Other parts of apparatus for telephony/telegraphy
1110,Microphones and their supports
1111,Specific piezo-eletric for appar./equip.of telephony
1112,Other microphones and their supports
1113,"Single loudspeakers, mounted in their enclosures"
1114,"Multiple loudspeakers, mounted in the same enclosure"
1115,Other loudspeakers
1116,Specific piezo-eletric for appar./equip.of telephony
1117,Other specific for teleph. appar./equip.
1118,"Earphones, including with microphones"
1119,Audio-frequency electric amplifiers
1120,Electric sound amplifier sets
1121,Parts of loudspeakers
1122,"Parts of microphones, earphones, amplifiers, etc"
1123,Oth.fixed capacitors with ceram.dielectric
1124,Fixed capacit.with diel.paper/plast.f/surf.moun.device
1125,Other fixed capacit.with dielec.paper/plastic
1126,"Oth.elec.capacitors, fixed, f/surf.moun.device"
1127,"Other electrical capacitors, fixed"
1128,"Electr.capacit., variable/adjustable f/surf.moun.device"
1129,"Other electrical capacitors, variable/adjustable"
1130,"Parts of electric.capacitors, fixed/variable/adjustable"
1131,"Electrical resistors, fixed, carbon, agglom./layers"
1132,"Electrical resistors, fixed, f/pot<=20w, of thread"
1133,"Electric.resistors, fixed, f/pot<=20w, f/surf.moun.device"
1134,"Other electric.resistors, fixed, f/pot<=20w"
1135,"Other electric.resistors, fixed"
1136,Potentiometers for potencyu <= 20w
1137,Oth.wirewound variable resistors(electrical)/pot<=20w
1138,Other potentiometers
1139,Other wirewound variable resistors (electrical)
1140,Thermistors
1141,Varistors for a voltage not exceeding 1000 V
1142,"Aerial simulators for transmitters, pot>=25kw"
1143,"Oth.electric.mach.apparatus,having individual functions"
1144,"Text terminals,oper.with baudot´s code transm.,etc"
1145,"Oth.electric.mach.apparatus,having individual functions"
1146,Parts of video radio-freq.amplifier mach.appar.etc.
1147,"Parts of oth.electr.mach.apparatus,having indiv.funct."
1148,"Insulated coppe wire f/winding,f/elect.use"
1149,"Insulated alluminium wire f/winding,f/elect.use"
1150,"Other insulated wires f/winding,f/elect.use"
1151,Co-axial cables and oth.co-axial electr.conductors
1152,Ignition wiring sets and other wiring sets used in veh.
1153,"Oth.electr.conductors with connection fitting,tens<=80v"
1154,"Other electric conductors f/tension<=100v, with pieces of connection"
1155,Other electric conductors f/tension<=80v
1156,"Oth.elect.conductors with connect.fittngs,80<t<=1000v"
1157,Other electric conductors 80v<tension<=1.000v
1158,"Motor-boats, other than outboard motor-boats"
1159,"Other vessels for pleasure or sports,incl.canoes"
1160,Tugs and pusher craft
1161,Dredgers
1162,"Floating/submersible drilling or product.platforms,etc."
1163,"Light-vessels/floating cranes/docks/flotation dikes,etc"
1164,Other vessels
1165,Warships
1166,"Other vessels, including lifeboats"
1167,Inflatable rafts
1168,Other floating structures
1169,Vessels and other floating structures f/breaking up
1170,"Optical fibres,nucleus diam.<11micron"
1171,Other optical fibres
1172,Optical fibre bundles and cables
1173,Sheets and plates of polarising material
1174,Other digital monolithic integrated circuits
1175,"Other monolithic integrated circuits,not mounted"
1176,Other digital analogical integrated circuits
1177,"Other monolithic integrated circuits,mounted"
1178,"Other monolithic integrated circuits,no mounted"
1179,"Oth.digital-analog.monolithic integr.circuits,mounted"
1180,"Other monolithic integr.circuits,mounted"
1181,"Digit.monolithic integrated circuits,no mounted"
1182,"Microcontrollers,mounted,f/surface mounted device (smd)"
1183,Other integrated circuits
1184,Steering wheels for motorized vehicles
1185,Steering columns for motor vehicles
1186,Steering boxes for motor vehicles
1187,"Inflatable bags of safety with system of inflating (""airbags"")"
1188,"Inflatable bags for ""airbags"""
1189,Airbag inflator for device of safety
1190,Outras partes e acess.de carrocarias p/veic.automoveis
1191,Other parts and access.f/tractors and motor vehicles
1192,"Device f/command,acceler.,brake,etc.f/motor vehicles"
1193,Other parts and access.f/tractors and motor vehicles
1194,"Elect.works trucks,n/fitted with lift.equip.in fact.etc"
1195,"Oth.works trucks,n/fitted with lift.equipm.in fact.etc"
1196,"Parts of works trucks,n/fitted with lift.equip.fact.etc"
1197,Vehicles and cars armored of combat and its parts
1198,Motorcyc.etc.with recip.int.comb.pist.engine cyl<=50cm3
1199,Motorcyc.with recip.int.comb.pist.eng.50cm3<cyl<=125cm3
1200,Motorc.with recip.int.comb.pist.eng.125cm3<cyl<=250cm3
1201,Gas masks
1202,Other respiration apparatus
1203,Articles and orthopaedic appliances
1204,Articles and fracture appliances
1205,"Parts/access.of articles/orthopaedic appliances,articul"
1206,Other parts/access.of orthopaedic/fracture
1207,"Prostheses articulate,femoral"
1208,"Prostheses articulate,myoelectric"
1209,Other prostheses articulate
1210,Articles and orthopaedic appliances
1211,Articles and fracture appliances
1212,Parts and access.of articles and orthopaed.appl.artic.
1213,Parts and access.of prostheses articulate/orthop.appl.
1214,Acrylic artificial teeth
1215,"Other artificial teeth, except of acrylic"
1216,Other articles and dental fittings appliances
1217,Mechanical heart valves
1218,Heart valves exc.mechanical
1219,Intra-ocular lenses
1220,Prostheses of covered vascular arteries
1221,Mammary prostheses n/implant
1222,Other radio-broad.recep.appar/equip. comb. with disc./cass.play. and rec.
1223,Other recep.appar.comb.with appar. sound. reprod./grab.
1224,"Other no commerc.recep.with rep./rec.apar/equip., comb. with clock"
1225,Tuning amplifiers (receiver)
1226,Other radio-broad.recep.appar./equip. with radiotel./radioteleg.
1227,Integ.receiver-decoder of dig.signs codif.videos colour
1228,Integr.receiv.-decod.without exit radio-freq.audio exit
1229,Oth.integ.receiver-decod.of dig.signs cod.videos colour
1230,Oth.recep.appar.f/col.telev.incl.sound/image apparatus
1231,"Recep.appar.f/blakc/white telev.incl.radio, etc."
1232,"Video monitors, colour"
1233,"Video monit., colour, with sweeping disposit.etc"
1234,"Other video monitors, colour"
1235,"Video monitors, black and white or oth.monochrome"
1236,Video projectors
1237,"Output unit for video, with monocr. crt (cathode ray tube)"
1238,"Digit.monolithic integrated circuits, no mounted"
1239,"Ram memories <=25ns,eprom,eeprom,prom,rom,flash"
1240,Other digital digital memories
1241,"Other ram memories <25ns,eprom,eeprom,prom,flash"
1242,Other ram memories <25ns
1243,"Hybrid.integrat.circuit. thick.<1micron, freq>800mhz"
1244,Other hybrid. integrat. circuit. thick<=1 micron
1245,"Other monolithic integr.circuits, no mounted"
1246,Transm/.recep.appar./equip.dig.p/radiotel.freq<15ghz
1247,"Rad. appar./equip., dig.freq. <=23ghz, rate <=8mbits/s"
1248,Other appar./equip. of digital radioteleph./radiotelegr.
1249,Appar./equip. transm.radioteleph./radiotelegr.
1250,Person.recept. of amateur radio with alfa-num presentation
1251,"Other rec. appar./equip.of telev., colour"
1252,Other monocr./black & white/ tv rec. appar./equip.
1253,"Aerials with parabolic reflectors, exc.f/phone cellular"
1254,"Other aerials, except for phone cellular"
1255,"Aerials for cellular phone portable, exc.telescopic"
1256,"Other aerials and aerial reflectors, its parts"
1257,Cabinets and framework f/transmis./receivers apparatus
1258,Cabinets and framework f/transmis./receivers apparatus
1259,Other parts f/transmission/receivers apparatus
1260,Other parts receivers apparatus radio-broad.televis.etc
1261,Oth.parts f/radar apparatus
1262,Other parts for radio navigational apparatus
1263,Oth.parts f/radio remote control appar/tv cameras/video
1264,Digital elec.appar.f/control of railways traffic
1265,Oth.electrical signalling appar.etc.for railways
1266,Digital elec.appar.f/control of self-driven traffic
1267,"Oth.electrical signalling appar.etc.f/terrest.roads, etc"
1268,Radio-freq. amplifier for microwave with low noise temp.<55k
1269,Radio-freq. amplifier for distribution of signs for television
1270,Other radio-freq amplifier for microwave sign recept.
1271,Other radio-freq amplifier for microwave sign transm.
1272,Other radio-freq. amplifiers
1273,Apparatus to electrocute insects
1274,Gener.of special effects with man.2 or 3 dimen. +d/10 inputs
1275,Digital character generators
1276,Frame synchroniz/curr. time base recorders
1277,Controllers of edition for video
1278,Real time digital mixers with 8 or more inputs
1279,Routing switches for  more than 20 inputs  and more than 16 outputs
1280,Other aux. machinery for video
1281,Television standard transcoders or converter
1282,"Aerial simulators for transmitters,pot>=25kw"
1283,"Text terminals,oper.with baudot´s code transm.,etc"
1284,Electric fence energisers
1285,"Balloons,dirigibles and other aircraft n/motorized"
1286,"Helicopters of weight<=2000kg,empty"
1287,"Helicopters 2000kg<weight<=3500kg,empty"
1288,"Other helicopters of weight>3500kg,empty"
1289,"Propeller-driven aeroplanes,etc.weight<=2000kg,empty"
1290,"Airplanes,turboprop,etc.single-engine<=2000kg,empty"
1291,"Airplanes,turboprop,etc,etc.multi-engine<=2000kg,empty"
1292,"Other aeroplanes/aircraft,weight<=2000kg,empty"
1293,"Propeller-driven aeropl.etc.2000kg<weight<=15000,empty"
1294,"Airplanes,turbopr.etc.multi-engine,2t<weight<=7t,empty"
1295,"Oth.airplanes,turboprop,etc.2t<weight<=7t,empty"
1296,"Airplanes,turbojet,etc.2000kg<weight<=7000kg,empty"
1297,"Oth.airplan. turbojet,etc.7000kg<weight<=15000kg,empty"
1298,"Oth.airplan./aircraft,2000kg<weight<=15000kg,empty"
1299,"Airplanes,turboprop,etc,weight>15000kg,empty"
1300,"Oth.airplanes/aircraft,weight>15000kg,empty"
1301,"Spacecraft and its spacecraft launch vehicles,etc."
1302,Other person. recep.appar./equip.of radiomessages
1303,Protocol translators for intercon.networks
1304,"Fixed terminals without own source of energy, mono-chanels"
1305,"Other appliances of radio-telecom, radio-telegraph, analog."
1306,"Other appar/equip. of radio-teleph., radio-telegraph"
1307,Other eletric. appar./equip.for teleph./telegr. by wire
1308,Printed circuits with assembled eletr./eletron. components
1309,"Specif.antenna for cellular telephone, except.telescopic"
1310,Other antennas except.for used in cellular telephone
1311,"Transm.appar./recep.of television, frequency>7ghz"
1312,Oth.transm.appar./recep.of television
1313,Transm.appar./recep.of trunking syst.f/switchboard
1314,Portable apparatus of trunking system
1315,"Fixed appar.trunking system, without inter.power source"
1316,"Portable apparatus trunking system, f/motor vehicles"
1317,Other transm.appar./recep.of trunking system
1318,"Transm.appar./recep.of radio-teleph.anal.portable, etc."
1319,"Transistors with dissipation capacity<1w,not mounted"
1320,"Transistors with dissip.cap.<1w,mounted,f/surf.mout.dev"
1321,"Oth.transis.with dissip.cap.<1w,oth.than photo-transis"
1322,"Transist.with dissip.cap.<1w,with heterojunction"
1323,"Oth.transis.with dissip.cap.<1w,oth.than photo-transis"
1324,Oth.transis.with dissip.cap.n/moun.ot.than photo-trans.
1325,"Oth.transis.with dissip.cap.moun.,oth.than photo-trans."
1326,"Thyristors,""diacs"",etc.n/mounted,current intesity<=3a"
1327,"Other thyristors,""diacs"",""triacs"",n/mounted"
1328,"Thyristors,""diacs"",etc.mounted,current intesity<=3a"
1329,"Other thyristors,""diacs"",""triacs"",mounted"
1330,"Light-emitting diodes (led) n/mounted,exc.laser"
1331,Laser diodes n/mounted
1332,Photo-diodes not mounted
1333,Photo-transistors not mounted
1334,Photo-thyristors not mounted
1335,Solar cells not mounted
1336,Motor vehicles with motor explosion/tipp.body wei<=5t
1337,"Motor vehic.refriger.etc.with motor explosion,wei<=5t"
1338,"Oth.motor vehicles with motor explosion,wei<=5t"
1339,"Chassis fitted with motor explosion and cab,wei>5t"
1340,Motor vehicles with motor explosion/tipp.body wei>5t
1341,"Motor vehic.refriger.etc.with motor explosion,wei>5t"
1342,"Oth.motor vehicles with motor explosion,wei>5t"
1343,Other motor vehicles for the transport of goods
1344,Crane lorries
1345,"Crane lorries max.capac.of elevat.>=60t,telescopic stem"
1346,Other crane lorries
1347,Mobile drilling derricks
1348,Fire-fighting-vehicles
1349,Concrete-mixer lorries
1350,Other motor vehicles for special use
1351,Lorries for profiling petroleum wells
1352,Other motor vehicles for special use
1353,Chassis with engines f/motor vehicles trans.persons>=10
1354,"Oth.instrum.and applian.used in geodesy,topography,etc"
1355,Parts and acess.of photogrammetric.instrum.and applian.
1356,"Parts/acess.of instrum./applian.used geodesy,topog.etc."
1357,Balances of a sensitivity of weight<=0.2mg
1358,Insulators of other matters for electric use
1359,Insulating fittings of ceramics f/mach.appar.elect.inst
1360,"Mounted object.lenses,zoom>=20,f/television cameras"
1361,"Oth.mounted object.lenses f/cameras,photogr.apparatus"
1362,Other mounted objective lenses
1363,Mounted polarizing filters
1364,Mounted  optical filters
1365,"Oth.lenses,prisms,mirrors and oth.optical elemen.mount."
1366,"Frames of plastics, for glasses"
1367,"Frames of base metal,f/glass,incl.veneer,etc"
1368,"Frames of other materials,for glasses"
1369,Hinges for frames of glasses
1370,Other parts for frames of glasses and similar articles
1371,Sunglasses
1372,Corrective spectacles
1373,Safety glasses
1374,Oth.goggles/oth.and the like and similar articles
1375,Binoculars
1376,"Monoculars other astronomy instrumets,its mountings"
1377,Parts and accessories of binoculars
1378,Parts and access.of monoculars and oth.astron.instrum.
1379,Photogr.cameras f/preparing printing plates/cylinders
1380,Fotocompositoras a laser para preparacao de cliches
1381,"Digital of recor.appar./reprod.of sound, of magn.tape"
1382,"Recor.appar./reprod.of sound, of magn.tape, of cassette"
1383,"Other recor.appar./reprod.of sound, of magnetic tape"
1384,"Metallic oxide  semiconductors,mos tech.,n/mounted"
1385,"Rom, prom,etc.memoirs mos tech.,mounted,f/surf.moun.dev"
1386,"Microprocessors,mos tech.,mounted,f/surf.moun.dev."
1387,"Microcontrollers mos tech.,mounted,f/surf.moun.dev."
1388,"Co-processors,mos tech,mounted,f/surf.moun.dev."
1389,"Semiconduc.""chip-set"",mos tech.,mounted,f/surf.moun.dev"
1390,"Other memories,mos tech.,mounted,f/surf.moun.dev"
1391,"Other semiconductors,mos tech.,mounted,f/surf.moun.dev"
1392,"Other rom,prom,etc.memories mos tech.,acess<=25ns"
1393,"Oth.microprocessors,of metallic oxide,mos technol."
1394,"Oth.microcontrollers,of metallic oxide,mos technol."
1395,"Other co-processors,of metallic oxide,mos technol."
1396,"Ot.semiconductors ""chip set"",of metallic oxide,mos tec."
1397,"Oth. metallic oxide memoirs,mos technology"
1398,Other parts/access.of bodies f/motor vehicles
1399,Mounted brakes and servo-brakes for dumpers and tractors
1400,Mounted brakes and servo-brakes for vehicles/automob.
1401,"Other brakes and its parts,f/tractors/vehicles/automob."
1402,Brakes and servo-brakes for dumpers and tractors
1403,Brakes and servo-brakes f/other motor vehicles
1404,"Other brakes and its parts,f/tractors/motor vehicles"
1405,Gear boxes f/dumpers/tractors except road
1406,Power-assisted f/torques>=750nm of tractors/dumpers
1407,Other gear boxes for tractors or dumpers
1408,Other gearboxes
1409,Parts of gearboxes
1410,Drive-axles with differential f/dumpers/tractors
1411,"Drive-axles with differential f/dumpers,load>=14t"
1412,Axles and parts except. drive/trac./dumpers
1413,Drive-axles with differential f/dumpers/tractors
1414,Drive-axles with differential f/motor vehicles
1415,Arterial embolectomy catheters of poly(vinyl chloride)
1416,Thermodilution catheters of poly(vinyl chloride)
1417,Peripheral intravenous catheters  of poliuretano
1418,"Other probes, catheters and stems"
1419,Lancets for vaccination and cauterising
1420,"Oth.syringes,needles,catheters,etc.similar instruments"
1421,"Article f/arteriovenous fistula,comp.needle,base,etc."
1422,"Oth.syringes,needles,catheters,etc.similar instruments"
1423,"Dental drill engines,incl.other dental equipment"
1424,"Dental drill engines, of tungsten carbide"
1425,"Dental drill engines, of vanadium steel"
1426,"Dental drill engines, of other material"
1427,Files for dentistry
1428,Operating by laser apparatus for use in the mouth
1429,Operat.by kinetic part.projection f/use in the mouth
1430,"Appar.f/build.ceramic parts f/dental use,computadorized"
1431,Other instruments and appliances for dentistry
1432,Other ophthalmic instruments and appliances
1433,"Other tv cameras, for imag. within infrav. spectr."
1434,Other television cameras
1435,Fix. imag. video camera with 3 or more imag. pickup (captivators)
1436,"Other video cameras, for imag. within infrav. spectr."
1437,Other video cameras of fixed images
1438,Radar apparatus
1439,Radio navigational apparatus
1440,Radio remote control apparatus
1441,Pocket-size radio cassette-players
1442,Oth.apar. combined w/apar.for rec. or playback of sound
1443,"Oth.recep.appar.radio-broad.comb.cass.players, pile/elec"
1444,Oth.recep.appar.radio comb.cass.players/recor.pile/elec
1445,"Recep.appar.radio comb.cass.players/casset.recor.pile,"
1446,"Discs for read.by laser, can be writ.only time"
1447,Other support. prep./sound record./similar
1448,"Writ. disc,for laser read., only sound reprod."
1449,"Discs for laser system, for dif.reprod. of sound/image"
1450,Other discs for  read. by laser system
1451,"Discs for reading system by laser, recorded only once"
1452,Other discs for reading system by laser
1453,"Flight data recorders, without device of sound reproduct"
1454,"Oth.sound recording appar., without device sound reprod"
1455,"Oth.sound recording appar., with device sound reproduc."
1456,Recording-reprod.of magnetic tape-type without tuner
1457,"Video recording/reproducing appar.f/casset.type, w=12mm"
1458,Oth.video record./reprod.appar.magn.tape-type w<19.05mm
1459,Oth.video recor./reprod.appar.magn.tape-type w>=19.05mm
1460,"Record./reproduc.and image/sound editor, magnetic disks"
1461,Other video recording or reproducing apparatus
1462,Pick-up cartridges f/recording or reproducing apparatus
1463,Needles with points of precious ston.f/reproduc.appar.
1464,Cabinets f/recording/reproducing apparatus
1465,Other multilayer integrated circuit
1466,"Fuses/cut-circuit of fuses, f/tension>1000volts"
1467,"Autom.circ.break.f/tens.sup.1 kv and less than 72, 5 kv"
1468,"Oth.autom.circ.break.f/tension equal or super.72, 5 kv"
1469,"Isol.swit./make-and-break sw.t>1kv, current<=1600a, n/aut"
1470,"Isol.swit./make-and-break sw.t>1kv, current<=1600a, aut"
1471,Vacuum swifts without autom. activ. device <=1600a
1472,Other swifts with no autom. activ. device <=1600a
1473,"Other swifts , except.contain. submerg. in liquid<=1600a"
1474,"Ot.isol.swit./make-and-break sw.t>1kv, current<=1600a"
1475,"Isol.swit./make-and-break sw.t>1kvcurrent>1600a, n/aut"
1476,"Isol.swit./make-and-break sw.t>1kv, current>1600a, aut"
1477,Vacuum swifts without autom. activ. device >1600a
1478,Other swifts with no autom. activ. device >1600a
1479,"Other swifts , except.contain. submerg. in liquid>1600a"
1480,Insulating fittings of plastics f/mach.appar.elect.inst
1481,"Stoppers f/capacitors,perfor.f/mount.electr.terminals"
1482,Oth.insul.fittings of plastics f/mach.appar.elect.inst
1483,Oth.insulat.fittings of tubes f/mach.appar.elect.inst
1484,"Waste/scrap of electric accumulators of lead,etc."
1485,"Waste/scrap of primary cells/elec.primary batteries,etc"
1486,Parts electric of other machines and apparatus
1487,Thermocouples used in thermoelectric gas devices
1488,Parts of other electrical machinery and apparatus
1489,Rail locomot.powered from an exter.source of electr.
1490,"Rail locomotives, of electric accumulators"
1491,Diesel-electric locomotives
1492,Other rail locomotives and locomotive tenders
1493,"Self-propelled,powered from an exter.source of elec."
1494,Other self-propelled
1495,Vehicles f/inspection/maintenance of railway/similar
1496,"Self-propelled vehicles,ballast tampers,railway alig."
1497,Outras cameras fotog p/ prep cliches/cilindros impressa
1498,"Photog.cameras f/recording documents on microfilm,etc"
1499,"Phot.cam.designed f/a kind used f/underwater,aerial,etc"
1500,Instant print photographic cameras
1501,"Phot.cam.with through-the-lens view.f/roll film,w<=35mm"
1502,"Other photographic cameras f/roll film,w<35mm"
1503,"Fixed focus photographic cameras,f/roll film,w=35mm"
1504,"Adjustable focus photograph.cameras,f/roll film,w=35mm"
1505,Other fixed focus photographic cameras
1506,Other adjustable focus photographic cameras
1507,"Adjustable focus photogr.cameras,f/negatives>=45mmx60mm"
1508,Other adjustable focus photographic cameras
1509,Discharge tube apparatus f/production of flashlight
1510,"Flashbulbs,flashcubes and the like f/picture"
1511,Other apparatus and devices for picture
1512,Cases for photographic apparatus
1513,Frames and bases f/recording/reproducing apparatus
1514,"Magnetic sound readers, f/recording/reproducing apparat."
1515,"Disc turning mech.incor.disc changers, f/reprod.apparat."
1516,Oth.parts and access.f/recording/reproducing apparatus
1517,Discs by laser reading for reproducing sound only
1518,Connectors of bunches or cables of optic fibers
1519,"Connectors f/flat cables parallel conductors, t<=1kv"
1520,"Sliding sockets for aerial conductors, t<=1kv"
1521,"Sockets f/electronic microstructures,f/tension<=1kv"
1522,"Connectors for printed circuits,f/tension<=1kv"
1523,"Connectors for printed circuits,incl.mount.insul.backin"
1524,"Oth.appar.f/interruption,etc.f/elect.circuits t<=1kv"
1525,"Support with apparatus of cnc,t<=1kv,c/proc/bus>=32bits"
1526,"Oth.boards,panels,etc.with appar.com.num.comp.t<=1kv"
1527,"Boards with programmable control apparatus,t<=1kv"
1528,Boards with control of elect.power demand appar.t<=1kv
1529,"Oth.boards,etc.with elect.circuit switches appar.t<=1kv"
1530,"Boards,etc.with elect.circuit switches appar.t>1kv"
1531,"Substacoes isoladas a gas(""gis"" ou ""his""),p/tensao>52kv"
1532,Brakes and parts thereof of vehicles f/railway
1533,"Other brakes and parts thereof,of vehicles f/railway"
1534,"Hooks,buffers,etc.of vehicles f/railway"
1535,Othter parts of locomotives
1536,Other parts of vehicles f/railway
1537,"Signalling mechanical apparatus f/railway,etc."
1538,"Signalling electro-mechanical apparatus f/railway,etc."
1539,Fixed material of railway/similar and its parts
1540,"Containers includ.the transport of fluids,etc."
1541,Pedestrian-controlled tractors
1542,Road tractors for semi-trailer
1543,Log-skidding tractors
1544,Other tractors
1545,"Motor vehicles f/transp.>=10 persons,with diesel engine"
1546,Trolleybuses for the transport >= 10 person
1547,Other motor vehicles for the transport>=10 person
1548,Appar.f/indirec.reprod.of photocopy monochrom.electr.
1549,"Oth.photocopying appar.,electr.(indirec.proces.)"
1550,"Photocopying apparatus,incorporating an optical system"
1551,"Photocopying apparatus,of the contact type"
1552,Thermo-copying apparatus
1553,Cylinder covered of selenium f/photoc.appar.ind.reprod.
1554,Parts and access.f/oth.photoc.appar./thermo-copying
1555,Automatic document feeders f/photocopyng apparatus
1556,Paper feeders f/photocopyng apparatus
1557,Sorters f/photocopyng apparatus
1558,Cylinder covered semiconduc.mater.f/photocop.apparatus
1559,Oth.parts of access.f/photocopying apparatus
1560,Tanks/trays autom.electr.program.f/developing photogr.
1561,Enlarging and printing mach.autom.f/phot.paper>1000c/h
1562,"Other appar./equipment f/autom.devel.photographic,etc"
1563,Direct write-on-wafer apparatus
1564,Step and repeat aligners
1565,Discs for uses other than reproducing sound and image
1566,Other optical media
1567,No-volatile data-storage based on semiconductors
1568,Memory cards
1569,Other devices of no-volatile data-storage
1570,Smart cards
1571,Cards and labels of activated for approach
1572,Other support. prep./sound record./similar
1573,Oth.unrecorded media f/sound recording/similar
1574,Discs f/laser read.syst.which may be record.once(cd-r)
1575,Oth.prepar.unrecorded media f/sound recording/similar
1576,"Gramophone records, recorded"
1577,"Record.disks f/laser reading, of difer.phen.sound/image"
1578,"Record.disks f/laser reading, reproducing sound only"
1579,"Other recorded disks, for laser reading"
1580,"Magnetic tapes recorded, f/reprod.dif.phen.sound/image"
1581,"Magnetic tapes recorded, w<=4mm, in cartridges/cassettes"
1582,"Other magnetic tapes recorded, w<=4mm"
1583,"Cabinets, backstages and  framework f/transm./rec. appar."
1584,Recorders/select.for autom. central of telef. etc.
1585,Other parts for appar./equip. of teleph./telegr.
1586,"Oth.telephonic or telegraphic apparatus, telecommunic."
1587,Apparatus of administration of nets (tmn)
1588,Centralizing of lines of subscribers
1589,Centralizing digital circuits (dcme)
1590,Oth.telephonic/telegraphic electr.centralizing
1591,Oth.electrical apparatus f/telephony/telegraphy
